name,uid,scraper_name,description,address,postcode,url,associated_id,app_size,app_state,app_type,start_date,decided_date,consulted_date,other_fields,altid,reference,link,area_id,area_name,last_scraped,last_different,lng,lat,location,last_changed,location_x,location_y
Hillingdon/38421/APP/2025/1315,38421/APP/2025/1315,Hillingdon,"Details pursuant to the partial discharge of Conditions 29 (Post-Construction Circular Economy Monitoring Report) and 30 (Post-Construction Whole Life-Cycle Carbon Assessment) of planning permission ref. 38421/APP/2021/4045, dated 25-11-2022 (Redevelopment of the site to deliver data centre campus including: two data centre buildings (Use Class B8); associated energy and electricity infrastructure, buildings, and plant; security gatehouse, systems and enclosures; works to the highway, car parking and cycle parking; hard and soft landscaping; as well as associated infrastructure, ancillary office use, and associated external works.)",LAND AT TUDOR WORKS BEACONSFIELD ROAD HAYES,,https://planning.hillingdon.gov.uk/OcellaWeb/planningDetails?reference=38421/APP/2025/1315&from=planningSearch,38421/APP/2021/4045,Medium,Undecided,Full,2025-05-09,,,"{'status': 'Undecided', 'id_type': 'APP - Planning Application', 'docs_url': 'https://planning.hillingdon.gov.uk/OcellaWeb/showDocuments?module=pl&reference=38421%2FAPP%2F2025%2F1315', 'ward_name': 'WOOD END 2022', 'source_url': 'https://planning.hillingdon.gov.uk/OcellaWeb/planningSearch', 'comment_url': 'https://planning.hillingdon.gov.uk/OcellaWeb/planningComment?reference=38421/APP/2025/1315&from=planningSearch', 'n_documents': 8, 'case_officer': 'See source', 'agent_address': 'Mr Nick Heard 2 Kingsway Cardiff CF10 3FD', 'date_received': '2025-05-09', 'date_validated': '2025-05-09', 'n_statutory_days': 133, 'target_decision_date': '2025-09-19'}",,,https://www.planit.org.uk/planapplic/Hillingdon/38421/APP/2025/1315/,310,Hillingdon,2025-09-22T10:49:56.328572,2025-09-13T14:35:16.325257,,,,2025-09-26T08:11:05.730185,,
SouthGloucestershire/DOC25/00152,DOC25/00152,SouthGloucestershire,Discharge of conditions 2 (LEMP) and 3 (Landscape Plan) attached to planning permission P24/02011/F. Erection of a single storey extension to form enlarged data centre with associated external plant and enclosures.,10 Goodrich Close Yate South Gloucestershire BS37 5YT,BS37 5YT,https://developments.southglos.gov.uk/online-applications/applicationDetails.do?keyVal=SVVX68OKJHP00&activeTab=summary,P24/02011/F,Small,Conditions,Conditions,2025-05-07,2025-07-18,,"{'lat': 51.53845143976132, 'lng': -2.4421327083582205, 'parish': 'Westerleigh And Coalpit Heath Parish Council', 'status': 'Decided', 'easting': 369432.0, 'map_url': 'https://developments.southglos.gov.uk/online-applications/applicationDetails.do?activeTab=map&keyVal=SVVX68OKJHP00', 'decision': 'Discharge of Conditions Decided', 'docs_url': 'https://developments.southglos.gov.uk/online-applications/applicationDetails.do?activeTab=documents&keyVal=SVVX68OKJHP00', 'northing': 182265.0, 'ward_name': 'Frampton Cotterell', 'agent_name': 'See source', 'decided_by': 'Fully Delegated', 'source_url': 'https://developments.southglos.gov.uk/online-applications/search.do?action=advanced', 'comment_url': 'https://developments.southglos.gov.uk/online-applications/applicationDetails.do?activeTab=neighbourComments&keyVal=SVVX68OKJHP00', 'n_documents': 12, 'case_officer': 'See source', 'comment_date': '2025-07-24', 'agent_address': 'Suite 22 Carlton Place 28 - 32 Greenwood Street Altrincham WA14 1RZ', 'date_received': '2025-05-07', 'n_constraints': 4, 'applicant_name': 'See source', 'date_validated': '2025-05-07', 'application_type': 'Discharge of Conditions', 'n_statutory_days': 56, 'planning_portal_id': 'PP-13997355', 'decision_issued_date': '2025-07-18', 'target_decision_date': '2025-07-02'}",,,https://www.planit.org.uk/planapplic/SouthGloucestershire/DOC25/00152/,25,South Gloucestershire,2025-08-01T09:28:03.70677,2025-08-01T09:28:03.70677,-2.442133,51.538451,"{'type': 'Point', 'coordinates': [-2.442133, 51.538451]}",2025-08-04T08:31:43.019521,-2.442133,51.538451
Renfrewshire/25/0335/EIASCR,25/0335/EIASCR,Renfrewshire,"Request for an Environmental Impact Assessment Screening Opinion for a flexible data centre campus, including ancillary offices/employment floorspace, internal/external plant and equipment, on-site wastewater pumping station, and emergency back-up generators and associated fuel storage.",Site 400 Metres South West Of Bent Farm Gleniffer Road Paisley,,https://pl-bs.renfrewshire.gov.uk/online-applications/applicationDetails.do?keyVal=SVVR6GMW00B00&activeTab=summary,,,Withdrawn,,2025-05-07,2025-05-19,,"{'lat': 55.803061969561256, 'lng': -4.487609452802974, 'parish': 'Elderslie Community Council', 'status': 'Decided', 'easting': 244177.0, 'map_url': 'https://pl-bs.renfrewshire.gov.uk/online-applications/applicationDetails.do?activeTab=map&keyVal=SVVR6GMW00B00', 'decision': 'Withdrawn', 'northing': 659443.0, 'ward_name': '7 - Paisley Southwest', 'agent_name': 'See source', 'decided_by': 'Delegated', 'n_comments': 0, 'source_url': 'https://pl-bs.renfrewshire.gov.uk/online-applications/search.do?action=advanced', 'comment_url': 'https://pl-bs.renfrewshire.gov.uk/online-applications/applicationDetails.do?activeTab=makeComment&keyVal=SVVR6GMW00B00', 'n_documents': 0, 'case_officer': 'See source', 'agent_address': '1 Bar Lane York YO1 6JU', 'agent_company': 'AAH Consultants', 'date_received': '2025-05-07', 'decision_date': '2025-05-19', 'n_constraints': 12, 'applicant_name': 'See source', 'date_validated': '2025-05-07', 'application_type': 'Opinion on Need for Env. Assessment', 'decision_issued_date': '2025-05-27'}",,,https://www.planit.org.uk/planapplic/Renfrewshire/25/0335/EIASCR/,388,Renfrewshire,2025-06-02T17:00:39.560139,2025-06-02T17:00:39.560139,-4.487609,55.803062,"{'type': 'Point', 'coordinates': [-4.487609, 55.803062]}",2025-06-04T08:31:48.095785,-4.487609,55.803062
ScottishBorders/25/00556/SCR,25/00556/SCR,ScottishBorders,Erection of data centre campus,The Laundry Field BESS Land North And East Of Stainrigg Mains Farm Coldstream Scottish Borders,,https://eplanning.scotborders.gov.uk/online-applications/applicationDetails.do?keyVal=SVVR76NT0BQ00&activeTab=summary,23/01376/SCR,Medium,Permitted,Outline,2025-05-07,2025-07-04,,"{'lat': 55.68294403096586, 'lng': -2.3592024153236975, 'parish': 'Leitholm, Eccles & Birgham C.C', 'status': 'Decided', 'easting': 377512.0, 'map_url': 'https://eplanning.scotborders.gov.uk/online-applications/applicationDetails.do?activeTab=map&keyVal=SVVR76NT0BQ00', 'decision': 'Screening/Scoping Opinion Issued', 'docs_url': 'https://eplanning.scotborders.gov.uk/online-applications/applicationDetails.do?activeTab=documents&keyVal=SVVR76NT0BQ00', 'northing': 643332.0, 'ward_name': 'Mid Berwickshire', 'agent_name': 'See source', 'n_comments': 2, 'source_url': 'https://eplanning.scotborders.gov.uk/online-applications/search.do?action=advanced', 'comment_url': 'https://eplanning.scotborders.gov.uk/online-applications/applicationDetails.do?activeTab=makeComment&keyVal=SVVR76NT0BQ00', 'n_documents': 6, 'case_officer': 'See source', 'agent_address': '1 Bar Lane York YO1 6JU', 'agent_company': 'Bethany Scott BSc (Hons), MRTPI', 'date_received': '2025-05-07', 'decision_date': '2025-07-04', 'n_constraints': 5, 'applicant_name': 'See source', 'date_validated': '2025-05-07', 'application_type': 'Screening Opinion', 'n_statutory_days': 21, 'decision_issued_date': '2025-07-04', 'target_decision_date': '2025-05-28', 'permission_expires_date': '2030-07-04'}",,,https://www.planit.org.uk/planapplic/ScottishBorders/25/00556/SCR/,379,Scottish Borders,2025-08-16T05:02:51.54267,2025-08-16T05:02:51.54267,-2.359202,55.682944,"{'type': 'Point', 'coordinates': [-2.359202, 55.682944]}",2025-08-30T12:16:38.521227,-2.359202,55.682944
Renfrewshire/25/0329/EIASCR,25/0329/EIASCR,Renfrewshire,Request for an Environmental Impact Assessment Screening Opinion for a data centre campus.,Site 400 Metres North East Of Glenview Caplaw Road Neilston,,https://pl-bs.renfrewshire.gov.uk/online-applications/applicationDetails.do?keyVal=SVU4SIMW03B00&activeTab=summary,,Small,Withdrawn,,2025-05-06,2025-05-19,,"{'lat': 55.8020399942707, 'lng': -4.487033607397108, 'parish': 'Elderslie Community Council', 'status': 'Decided', 'easting': 244209.0, 'map_url': 'https://pl-bs.renfrewshire.gov.uk/online-applications/applicationDetails.do?activeTab=map&keyVal=SVU4SIMW03B00', 'decision': 'Withdrawn', 'docs_url': 'https://pl-bs.renfrewshire.gov.uk/online-applications/applicationDetails.do?activeTab=documents&keyVal=SVU4SIMW03B00', 'northing': 659328.0, 'ward_name': '7 - Paisley Southwest', 'agent_name': 'See source', 'decided_by': 'Delegated', 'n_comments': 0, 'source_url': 'https://pl-bs.renfrewshire.gov.uk/online-applications/search.do?action=advanced', 'comment_url': 'https://pl-bs.renfrewshire.gov.uk/online-applications/applicationDetails.do?activeTab=makeComment&keyVal=SVU4SIMW03B00', 'n_documents': 1, 'case_officer': 'See source', 'agent_address': '1 Bar Lane York YO1 6JU', 'agent_company': 'AAH Consultants', 'date_received': '2025-05-06', 'decision_date': '2025-05-19', 'n_constraints': 7, 'applicant_name': 'See source', 'date_validated': '2025-05-06', 'application_type': 'Opinion on Need for Env. Assessment', 'decision_issued_date': '2025-05-19'}",,,https://www.planit.org.uk/planapplic/Renfrewshire/25/0329/EIASCR/,388,Renfrewshire,2025-06-02T19:07:36.939444,2025-06-02T19:07:36.939444,-4.487034,55.80204,"{'type': 'Point', 'coordinates': [-4.487034, 55.80204]}",2025-06-04T08:31:48.110699,-4.487034,55.80204
Hart/25/00865/AMCON,25/00865/AMCON,Hart,"Variation of Condition 2 (Approved Drawings), Condition 3 (Drainage Strategy), Condition 8 (Car Parking Facilities) and Condition 9 (Cycle Parking Facilities) attached to planning permission 22/01088/FUL dated 13/01/2023 - Erection of two storey data centre and plant enclosure on existing car park",Cody Technology Park Ively Road Farnborough,,https://publicaccess.hart.gov.uk/online-applications/applicationDetails.do?activeTab=summary&keyVal=SVUH3AHZJRV00,22/01088/FUL,Medium,Permitted,Conditions,2025-05-06,2025-09-10,2025-06-04,"{'lat': 51.28005543065093, 'lng': -0.7976667946936434, 'parish': 'Fleet Parish', 'status': 'Grant', 'easting': 483956.0, 'map_url': 'https://publicaccess.hart.gov.uk/online-applications/applicationDetails.do?activeTab=map&keyVal=SVUH3AHZJRV00', 'decision': 'Grant', 'docs_url': 'https://publicaccess.hart.gov.uk/online-applications/applicationDetails.do?activeTab=documents&keyVal=SVUH3AHZJRV00', 'northing': 154121.0, 'ward_name': 'Fleet East Ward', 'agent_name': 'See source', 'decided_by': 'Delegated Decision', 'n_comments': 5, 'source_url': 'https://publicaccess.hart.gov.uk/online-applications/search.do?action=advanced', 'comment_url': 'https://publicaccess.hart.gov.uk/online-applications/applicationDetails.do?activeTab=makeComment&keyVal=SVUH3AHZJRV00', 'n_documents': 26, 'case_officer': 'See source', 'agent_address': '10 York Road London SE1 7ND', 'agent_company': 'Union4 Planning', 'date_received': '2025-05-06', 'applicant_name': 'See source', 'date_validated': '2025-05-08', 'application_type': 'Amend Condition(s)', 'n_statutory_days': 91, 'planning_portal_id': 'PP-13991862', 'decision_issued_date': '2025-09-10', 'target_decision_date': '2025-08-07', 'consultation_end_date': '2025-06-04'}",,,https://www.planit.org.uk/planapplic/Hart/25/00865/AMCON/,122,Hart,2025-09-20T17:37:49.885167,2025-09-20T17:37:49.885167,-0.797667,51.280055,"{'type': 'Point', 'coordinates': [-0.797667, 51.280055]}",2025-09-22T08:03:53.282694,-0.797667,51.280055
Birmingham/2025/02529/PA,2025/02529/PA,Birmingham,"Change of use of the existing building to include data centre (Sui Generis), in addition to the permitted Class E(g) and B8 uses together with the erection and installation of associated plant and equipment which will includes solar panels; generator compound (with screening), fuel store and bund, transformer station, cooling plant (with screening), turnstile gate in fencing, fencing, new fence gates, pump room, bin store together with associated fencing, landscaping and parking (amended description).",35 Rocky Lane Nechells Birmingham B6 5RQ,B6 5RQ,https://eplanning.birmingham.gov.uk/Northgate/PlanningExplorer/Generic/StdDetails.aspx?PT=PlanningApplicationsOn-Line&TYPE=PL/PlanningPK.xml&PARAM0=1347654&XSLT=/Northgate/PlanningExplorer/SiteFiles/Skins/Birmingham/xslt/PL/PLDetails.xslt&FT=PlanningApplicationDetails&PUBLIC=Y&XMLSIDE=&DAURI=PLANNING,,Small,,Full,2025-05-05,,,"{'district': 'Ladywood', 'docs_url': 'http://eplanning.idox.birmingham.gov.uk/publisher/mvc/listDocuments?identifier=Planning&reference=2025/02529/PA', 'ward_name': 'Nechells', 'source_url': 'https://eplanning.birmingham.gov.uk/Northgate/PlanningExplorer/GeneralSearch.aspx', 'n_documents': 25, 'case_officer': 'See source', 'date_received': '2025-05-05', 'applicant_name': 'See source', 'date_validated': '2025-06-17', 'application_type': 'Full Planning', 'n_statutory_days': 49, 'application_expires_date': '2025-08-05'}",,,https://www.planit.org.uk/planapplic/Birmingham/2025/02529/PA/,282,Birmingham,2025-09-16T09:48:51.388623,2025-08-13T04:47:07.595344,-1.88064,52.497303,"{'type': 'Point', 'coordinates': [-1.88064, 52.497303]}",2025-09-17T07:34:38.209418,-1.88064,52.497303
Wycombe/25/06079/MINAMD,25/06079/MINAMD,Wycombe,"Proposed non-material amendment to permission for Erection of 4 no. Data centre buildings (sui generis use) together with associated groundworks, plant, electricity sub-station, security fence, gates and piers, landscaping, amendment to existing vehicular access(es), internal roads, service areas and provision of 150 car parking spaces with retention of the existing office building and ""Ballroom"" building fronting Haw Lane for ancillary operational uses and demolition of all other buildings and structures granted under planning ref: 22/06872/VCDN",Former Molins Site Haw Lane Saunderton Buckinghamshire,,https://publicaccess.wycombe.gov.uk/idoxpa-web/applicationDetails.do?keyVal=SVMRZWSCIUA00&activeTab=summary,22/06872/VCDN,Small,Rejected,Amendment,2025-05-02,2025-05-23,,"{'lat': 51.67988192174845, 'lng': -0.832438307579392, 'parish': 'Bledlow Cum Saunderton Parish Council', 'status': 'Decided', 'easting': 480822.0, 'map_url': 'https://publicaccess.wycombe.gov.uk/idoxpa-web/applicationDetails.do?activeTab=map&keyVal=SVMRZWSCIUA00', 'decision': 'Application Refused', 'docs_url': 'https://publicaccess.wycombe.gov.uk/idoxpa-web/applicationDetails.do?activeTab=documents&keyVal=SVMRZWSCIUA00', 'northing': 198547.0, 'ward_name': 'Ridgeway West', 'agent_name': 'See source', 'decided_by': 'Delegated Decision', 'source_url': 'https://publicaccess.wycombe.gov.uk/idoxpa-web/search.do?action=advanced', 'comment_url': 'https://publicaccess.wycombe.gov.uk/idoxpa-web/applicationDetails.do?activeTab=makeComment&keyVal=SVMRZWSCIUA00', 'n_documents': 8, 'case_officer': 'See source', 'agent_address': '70 St Mary Axe London EC3A 8BE', 'date_received': '2025-05-02', 'decision_date': '2025-05-23', 'applicant_name': 'See source', 'date_validated': '2025-05-02', 'application_type': 'Proposed non material amendment', 'n_statutory_days': 28, 'planning_portal_id': 'PP-13988740', 'decision_issued_date': '2025-05-23', 'target_decision_date': '2025-05-30'}",,,https://www.planit.org.uk/planapplic/Wycombe/25/06079/MINAMD/,60,Wycombe,2025-06-06T02:35:38.13578,2025-06-06T02:35:38.13578,-0.832438,51.679882,"{'type': 'Point', 'coordinates': [-0.832438, 51.679882]}",2025-06-10T09:06:20.463729,-0.832438,51.679882
Hillingdon/79468/APP/2025/1250,79468/APP/2025/1250,Hillingdon,"OUT OF BOROUGH CONSULTATION FROM EALING COUNCIL FOR: Request for a Screening Opinion under Regulation 6 of the Town and Country Planning (Environmental Impact Assessment) Regulations 2017 (as amended) in respect of proposals by Cyrus One for the development and use of the Site to provide a hyperscale data centre facility with ancillary office accommodation, flexible workspace with ancillary retail/ cafe/ community space, provision of a substation and gatehouse.","FORMER HONEY MONSTER FACTORY, BRIDGE ROAD OUTBOROUGH MIDDLESEX UB2 4AB",UB2 4AB,https://planning.hillingdon.gov.uk/OcellaWeb/planningDetails?reference=79468/APP/2025/1250&from=planningSearch,,Small,Permitted,Full,2025-05-02,2025-09-10,,"{'status': 'No Further Action(P)', 'id_type': 'APP - Planning Application', 'docs_url': 'https://planning.hillingdon.gov.uk/OcellaWeb/showDocuments?module=pl&reference=79468%2FAPP%2F2025%2F1250', 'ward_name': 'WOOD END 2022', 'source_url': 'https://planning.hillingdon.gov.uk/OcellaWeb/planningSearch', 'comment_url': 'https://planning.hillingdon.gov.uk/OcellaWeb/planningComment?reference=79468/APP/2025/1250&from=planningSearch', 'n_documents': 4, 'case_officer': 'See source', 'agent_address': 'London Borough of Ealing 14-16 Perceval House Uxbridge Road Ealing London W5 2HL', 'date_received': '2025-05-02', 'decision_date': '2025-09-10', 'date_validated': '2025-06-04', 'n_statutory_days': 21, 'target_decision_date': '2025-06-25'}",,,https://www.planit.org.uk/planapplic/Hillingdon/79468/APP/2025/1250/,310,Hillingdon,2025-09-22T10:49:43.115486,2025-09-13T14:34:57.106314,-0.372668,51.504498,"{'type': 'Point', 'coordinates': [-0.372668, 51.504498]}",2025-09-26T08:11:05.843117,-0.372668,51.504498
WestLothian/0346/EIA/25,0346/EIA/25,WestLothian,EIA screening opinion for a data centre campus,Land At Former Freeport Shopping & Leisure Village Westwood West Calder West Lothian EH55 8PN,EH55 8PN,https://planning.westlothian.gov.uk/publicaccess/applicationDetails.do?keyVal=SVMIAPRJ04A00&activeTab=summary,,Large,Permitted,Outline,2025-05-02,2025-06-04,,"{'lat': 55.85685358915243, 'lng': -3.594571481038344, 'parish': 'Stoneyburn', 'status': 'Decided', 'easting': 300283.0, 'map_url': 'https://planning.westlothian.gov.uk/publicaccess/applicationDetails.do?activeTab=map&keyVal=SVMIAPRJ04A00', 'decision': 'Environmental Assessment Not Required', 'docs_url': 'https://planning.westlothian.gov.uk/publicaccess/applicationDetails.do?activeTab=documents&keyVal=SVMIAPRJ04A00', 'northing': 663779.0, 'ward_name': 'Fauldhouse & The Breich Valley', 'agent_name': 'See source', 'decided_by': 'Delegated Powers', 'n_comments': 1, 'source_url': 'https://planning.westlothian.gov.uk/publicaccess/search.do?action=advanced', 'comment_url': 'https://planning.westlothian.gov.uk/publicaccess/applicationDetails.do?activeTab=makeComment&keyVal=SVMIAPRJ04A00', 'n_documents': 3, 'case_officer': 'See source', 'comment_date': '2025-05-23', 'agent_address': '1 Bar Lane York YO1 6JU', 'agent_company': 'AAH Consultants', 'date_received': '2025-05-02', 'n_constraints': 239, 'applicant_name': 'See source', 'date_validated': '2025-05-02', 'application_type': 'Environmental Impact Assessment', 'n_statutory_days': 60, 'decision_issued_date': '2025-06-04', 'target_decision_date': '2025-07-01'}",,,https://www.planit.org.uk/planapplic/WestLothian/0346/EIA/25/,390,West Lothian,2025-06-18T04:22:31.562318,2025-06-18T04:22:31.562318,-3.594571,55.856854,"{'type': 'Point', 'coordinates': [-3.594571, 55.856854]}",2025-06-20T08:56:09.626187,-3.594571,55.856854
Ealing/251707SCE,251707SCE,Ealing,"Request for a Screening Opinion under Regulation 6 of the Town and Country Planning (Environmental Impact Assessment) Regulations 2017 (as amended) in respect of proposals by Cyrus One for the development and use of the Site to provide a hyperscale data centre facility with ancillary office accommodation, flexible workspace with ancillary retail/ caf/ community space, provision of a substation and gatehouse. (Please see report for full proposal)",Former Honey Monster Factory Bridge Road Southall UB2 4AB,UB2 4AB,https://pam.ealing.gov.uk/online-applications/applicationDetails.do?keyVal=SVKQS3JM0KW00&activeTab=summary,,Medium,Permitted,Outline,2025-04-30,2025-06-13,2025-05-23,"{'lat': 51.50305261661676, 'lng': -0.36774852433828725, 'status': 'Environmental Statement Not required', 'easting': 513388.0, 'map_url': 'https://pam.ealing.gov.uk/online-applications/applicationDetails.do?activeTab=map&keyVal=SVKQS3JM0KW00', 'decision': 'Environmental Statement Not required', 'docs_url': 'https://pam.ealing.gov.uk/online-applications/applicationDetails.do?activeTab=documents&keyVal=SVKQS3JM0KW00', 'northing': 179498.0, 'ward_name': 'Norwood Green', 'decided_by': 'Delegated Decision', 'n_comments': 0, 'source_url': 'https://pam.ealing.gov.uk/online-applications/search.do?action=advanced', 'comment_url': 'https://pam.ealing.gov.uk/online-applications/applicationDetails.do?activeTab=makeComment&keyVal=SVKQS3JM0KW00', 'n_documents': 5, 'case_officer': 'See source', 'date_received': '2025-04-30', 'decision_date': '2025-06-13', 'n_constraints': 7, 'applicant_name': 'See source', 'date_validated': '2025-04-30', 'application_type': 'Screening Opinion', 'n_statutory_days': 21, 'applicant_address': '70 St Mary Axe London EC3A 8BE', 'decision_issued_date': '2025-06-13', 'target_decision_date': '2025-05-21', 'consultation_end_date': '2025-05-23', 'consultation_start_date': '2025-05-02', 'permission_expires_date': '2030-06-13'}",,,https://www.planit.org.uk/planapplic/Ealing/251707SCE/,302,Ealing,2025-06-28T14:35:37.781566,2025-06-28T14:35:37.781566,-0.367749,51.503053,"{'type': 'Point', 'coordinates': [-0.367749, 51.503053]}",2025-07-05T09:29:54.480723,-0.367749,51.503053
SouthLanarkshire/P/25/0490,P/25/0490,SouthLanarkshire,"Proposed data centre campus including ancillary offices/employment floorspace,internal/external plant and equipment, emergency back up generators, associated fuel storage, a Battery Energy Storage System (BESS) along with internal roads and parking, hard and soft landscaping, security perimeter fencing, lighting and electricity sub station (Screening Opinion request)",Land At Haspielaw Farm Muttonhole Road Hamilton ML3 8RX,ML3 8RX,https://publicaccess.southlanarkshire.gov.uk/online-applications/applicationDetails.do?keyVal=SVHBOUOP09500&activeTab=summary,,Medium,Permitted,Outline,2025-04-29,2025-06-25,,"{'lat': 55.741923322091694, 'lng': -4.072859510387473, 'status': 'Decided', 'easting': 269965.0, 'map_url': 'https://publicaccess.southlanarkshire.gov.uk/online-applications/applicationDetails.do?activeTab=map&keyVal=SVHBOUOP09500', 'decision': 'Screening opinion - EIA required', 'northing': 651784.0, 'ward_name': '18 Hamilton West And Earnock', 'agent_name': 'See source', 'decided_by': 'Delegated', 'n_comments': 0, 'source_url': 'https://publicaccess.southlanarkshire.gov.uk/online-applications/search.do?action=advanced', 'comment_url': 'https://publicaccess.southlanarkshire.gov.uk/online-applications/applicationDetails.do?activeTab=makeComment&keyVal=SVHBOUOP09500', 'n_documents': 0, 'case_officer': 'See source', 'agent_address': '1 Bar Lane York YO1 6JU', 'date_received': '2025-04-29', 'decision_date': '2025-06-26', 'applicant_name': 'See source', 'date_validated': '2025-05-13', 'application_type': 'Screening opinion request', 'n_statutory_days': 14, 'decision_issued_date': '2025-06-25', 'target_decision_date': '2025-05-27', 'permission_expires_date': '2025-06-25'}",,,https://www.planit.org.uk/planapplic/SouthLanarkshire/P/25/0490/,382,South Lanarkshire,2025-07-11T00:10:49.240925,2025-07-11T00:10:49.240925,-4.07286,55.741923,"{'type': 'Point', 'coordinates': [-4.07286, 55.741923]}",2025-07-16T08:28:19.012468,-4.07286,55.741923
Stirling/SCRN-25-002,SCRN-25-002,Stirling,"Request for screening opinion under Regulation 8 of the Town and Country Planning (Environmental Impact Assessment) Regulations 2017 (as amended), with regard to the proposed development comprising for the construction of a Data Centre Campus on Land near A9, Old Plean, Plean, Stirling.",Land East Of Carbrook Steadings Plean,,https://pabs.stirling.gov.uk/online-applications/applicationDetails.do?keyVal=SVH9SLPI0CE00&activeTab=summary,,Medium,Withdrawn,Outline,2025-04-29,2025-07-18,,"{'parish': 'Plean Community Council', 'status': 'Awaiting decision', 'map_url': 'https://pabs.stirling.gov.uk/online-applications/applicationDetails.do?activeTab=map&keyVal=SVH9SLPI0CE00', 'decision': 'Closed', 'ward_name': 'Ward 7 Bannockburn', 'agent_name': 'See source', 'decided_by': 'Delegated', 'n_comments': 0, 'source_url': 'https://pabs.stirling.gov.uk/online-applications/search.do?action=advanced', 'comment_url': 'https://pabs.stirling.gov.uk/online-applications/applicationDetails.do?activeTab=makeComment&keyVal=SVH9SLPI0CE00', 'n_documents': 0, 'case_officer': 'See source', 'agent_address': '1 Bar Lane York YO1 6JU', 'agent_company': 'Bethany Scott', 'date_received': '2025-04-29', 'decision_date': '2025-07-18', 'applicant_name': 'See source', 'date_validated': '2025-04-29', 'application_type': 'Screening Opinion', 'n_statutory_days': 21, 'decision_issued_date': '2025-07-18', 'target_decision_date': '2025-05-20', 'permission_expires_date': '2030-07-18'}",,,https://www.planit.org.uk/planapplic/Stirling/SCRN-25-002/,383,Stirling,2025-08-02T07:28:26.254757,2025-08-02T07:28:26.254757,,,,2025-08-05T08:46:02.058163,,
