name,uid,scraper_name,description,address,postcode,url,associated_id,app_size,app_state,app_type,start_date,decided_date,consulted_date,other_fields,altid,reference,link,area_id,area_name,last_scraped,last_different,lng,lat,location,last_changed,location_x,location_y
WestBerkshire/25/01397/COND,25/01397/COND,WestBerkshire,"Approval of details reserved by Conditions (6) CMS, (36) Surface Water Management Strategy, (42) LEMP, (43) CEMP, (48) Emergency Planning (i) and (52) Water Provision (i) of planning permission 20/02029/COMIND: Development of an Energy Recovery Centre and adjacent Data Centre and associated infrastructure",Reading Quarry Berrys Lane Burghfield Reading RG30 3EY,RG30 3EY,https://publicaccess.westberks.gov.uk/online-applications/applicationDetails.do?keyVal=SXXYHQRDKNK00&activeTab=summary,20/02029/COMIND,Small,Undecided,Conditions,2025-06-16,,2025-07-09,"{'lat': 51.422923984987186, 'lng': -1.017914931022731, 'parish': 'Burghfield Parish Council', 'status': 'Awaiting decision', 'easting': 468382.0, 'map_url': 'https://publicaccess.westberks.gov.uk/online-applications/applicationDetails.do?activeTab=map&keyVal=SXXYHQRDKNK00', 'docs_url': 'https://publicaccess.westberks.gov.uk/online-applications/applicationDetails.do?activeTab=documents&keyVal=SXXYHQRDKNK00', 'northing': 169781.0, 'ward_name': 'Burghfield & Mortimer', 'agent_name': 'See source', 'n_comments': 0, 'source_url': 'https://publicaccess.westberks.gov.uk/online-applications/search.do?action=advanced', 'comment_url': 'https://publicaccess.westberks.gov.uk/online-applications/applicationDetails.do?activeTab=makeComment&keyVal=SXXYHQRDKNK00', 'n_documents': 4, 'case_officer': 'See source', 'comment_date': '2025-07-09', 'agent_address': '5 Fox Valley Way Sheffield S36 2AA United Kingdom', 'agent_company': 'Enzygo', 'date_received': '2025-06-16', 'n_constraints': 16, 'applicant_name': 'See source', 'date_validated': '2025-06-17', 'application_type': 'Discharge/Compliance of Condition(s)', 'n_statutory_days': 56, 'target_decision_date': '2025-08-12', 'consultation_end_date': '2025-07-09'}",,,https://www.planit.org.uk/planapplic/WestBerkshire/25/01397/COND/,37,West Berkshire,2025-06-18T21:12:40.018774,2025-06-18T21:12:40.018774,-1.017915,51.422924,"{'type': 'Point', 'coordinates': [-1.017915, 51.422924]}",2025-06-20T08:55:49.592453,-1.017915,51.422924
Rushmoor/25/00328/SCOPE,25/00328/SCOPE,Rushmoor,"Request for an EIA Scoping Opinion : Proposed development comprising the partial demolition and partial retention of existing structures and phased construction of a new commercial development to provide the following uses over several development plots with a total maximum floorspace of 143,000m2 GEA: Up to approximately 46,000m2 GEA of flexible commercial floorspace (Class E(g)(ii), E(g)(iii), B2 and B8); Up to approximately 35,000m2 GEA of B8 storage or distribution (including Data Centres); Up to approximately 32,000m2 GEA of flexible commercial floorspace (Class E(g)(i), E(g)(ii), E(g)(iii), and B8); and Up to approximately 30,000m2 GEA of flexible commercial floorspace (Class E(g)(iii), B2 and B8 (including Data Centres); with public realm and associated works",Cody Technology Park Ively Road Farnborough Hampshire GU14 0LX,GU14 0LX,https://publicaccess.rushmoor.gov.uk/online-applications/applicationDetails.do?keyVal=SXXXTQNM0HX00&activeTab=summary,,Medium,Permitted,Outline,2025-06-16,2025-07-22,2025-07-08,"{'lat': 51.28038802580836, 'lng': -0.7871913411798567, 'status': 'Decided', 'easting': 484686.0, 'map_url': 'https://publicaccess.rushmoor.gov.uk/online-applications/applicationDetails.do?activeTab=map&keyVal=SXXXTQNM0HX00', 'decision': 'Scoping Report Issued', 'docs_url': 'https://publicaccess.rushmoor.gov.uk/online-applications/applicationDetails.do?activeTab=documents&keyVal=SXXXTQNM0HX00', 'northing': 154170.0, 'ward_name': ""St Mark's"", 'agent_name': 'See source', 'decided_by': 'Service Manager', 'n_comments': 8, 'source_url': 'https://publicaccess.rushmoor.gov.uk/online-applications/search.do?action=advanced', 'comment_url': 'https://publicaccess.rushmoor.gov.uk/online-applications/applicationDetails.do?activeTab=makeComment&keyVal=SXXXTQNM0HX00', 'n_documents': 16, 'case_officer': 'See source', 'comment_date': '2025-07-08', 'agent_address': 'Fao: Ms Susie Stephen 7 Soho Square London W1D 3QB', 'date_received': '2025-06-16', 'applicant_name': 'See source', 'date_validated': '2025-06-16', 'application_type': 'EA Scoping Opinion', 'n_statutory_days': 35, 'decision_issued_date': '2025-07-22', 'target_decision_date': '2025-07-21', 'consultation_end_date': '2025-07-08', 'consultation_start_date': '2025-06-17', 'permission_expires_date': '2025-07-22'}",,,https://www.planit.org.uk/planapplic/Rushmoor/25/00328/SCOPE/,125,Rushmoor,2025-08-08T20:54:58.089315,2025-08-08T20:54:58.089315,-0.787191,51.280388,"{'type': 'Point', 'coordinates': [-0.787191, 51.280388]}",2025-08-13T08:29:11.342617,-0.787191,51.280388
ChilternSouthBucks/PL/25/1899/EIASR,PL/25/1899/EIASR,ChilternSouthBucks,Request for an EIA Screening Opinion under Regulation 5(6) of the Town and Country Planning (Environmental Impact Assessment) Regulations 2017 (as amended) in relation to a proposed data centre development within Thorney Business Park,Thorney Business Park Thorney Lane North Iver Buckinghamshire,,https://pa-csb.buckinghamshire.gov.uk/online-applications/applicationDetails.do?keyVal=SXZUHOES0R600&activeTab=summary,,Medium,Undecided,Outline,2025-06-16,,,"{'lat': 51.50877990261712, 'lng': -0.5159392683346895, 'parish': 'Iver Parish Council', 'status': 'Registered', 'easting': 503090.0, 'map_url': 'https://pa-csb.buckinghamshire.gov.uk/online-applications/applicationDetails.do?activeTab=map&keyVal=SXZUHOES0R600', 'docs_url': 'https://pa-csb.buckinghamshire.gov.uk/online-applications/applicationDetails.do?activeTab=documents&keyVal=SXZUHOES0R600', 'northing': 179916.0, 'ward_name': 'Iver', 'agent_name': 'See source', 'decided_by': 'Delegated Decision', 'source_url': 'https://pa-csb.buckinghamshire.gov.uk/online-applications/search.do?action=advanced', 'comment_url': 'https://pa-csb.buckinghamshire.gov.uk/online-applications/applicationDetails.do?activeTab=makeComment&keyVal=SXZUHOES0R600', 'n_documents': 2, 'case_officer': 'See source', 'agent_address': 'Sunley House 4 Bedford Park Surrey Croydon CR0 2AP', 'agent_company': 'AECOM Limited', 'date_received': '2025-06-16', 'applicant_name': 'See source', 'date_validated': '2025-06-16', 'application_type': 'EIA screening request', 'n_statutory_days': 21, 'target_decision_date': '2025-07-07'}",,,https://www.planit.org.uk/planapplic/ChilternSouthBucks/PL/25/1899/EIASR/,513,Chiltern South Bucks,2025-06-29T18:28:01.77192,2025-06-29T18:28:01.77192,-0.515939,51.50878,"{'type': 'Point', 'coordinates': [-0.515939, 51.50878]}",2025-07-05T08:56:41.201636,-0.515939,51.50878
Glasgow/25/01338/MSC,25/01338/MSC,Glasgow,"Mixed-use University campus development including: (1) teaching and learning buildings (Class 10) (up to 65,000 sq m); (2) University research buildings (Class 4) (up to 17,000 sq m); (3) commercial research & development/offices (Class 4) (up to 18,000 sq m); (4) retail shops (Class 1) (up to 4,000 sq m); (5) financial, professional and other services (Class 2) (up to 500 sq m; (6) food and drink (Class 3) (up to 2,500 sq m); (7) hotels (Class 7) (up to 12,500 sq m); (8) sports and recreation facilities (Class 11) (up to 500 sq m); (9) day nursery (Class 10) (up to 500 sq m); (10) crche (Class 10) (up to 100 sq m) (11) residential flats (mainstream or student) (sui generis) (up to 14,500.sq m); (12) Data Centre (Class 4) (up to 3,000 sq m); (13) energy centre (sui generis); (14) means of access, servicing and parking arrangements: (15) related infrastructure; (16) related landscaping and (17) related public realm and demolition of existing buildings - Approval of matters specified in conditions 02 (1-5, 7-10, 12-15), 03, 09 - 15, 22, 23, 25 - 29, 35, 36, 38, and 41 of Planning Permission in Principle 19/00363/PPP, for the erection of an Innovation Hub (Class 4), with ancillary facilities, food and drink (Class 3), open space, and incorporating and altering the listed Pathology Building, related infrastructure, landscaping and public realm (in so far as these relate to the development of Plot J)",Site At University Avenue Glasgow,,https://publicaccess.glasgow.gov.uk/online-applications/applicationDetails.do?keyVal=SXSXWTEXMYY00&activeTab=summary,"14,500.sq 19/00363/PPP",Medium,Undecided,Conditions,2025-06-13,,2025-07-18,"{'parish': 'Hillhead', 'status': 'Pending - Consideration', 'map_url': 'https://publicaccess.glasgow.gov.uk/online-applications/applicationDetails.do?activeTab=map&keyVal=SXSXWTEXMYY00', 'docs_url': 'https://publicaccess.glasgow.gov.uk/online-applications/applicationDetails.do?activeTab=documents&keyVal=SXSXWTEXMYY00', 'ward_name': 'Hillhead', 'agent_name': 'See source', 'n_comments': 0, 'source_url': 'https://publicaccess.glasgow.gov.uk/online-applications/search.do?action=advanced', 'comment_url': 'https://publicaccess.glasgow.gov.uk/online-applications/applicationDetails.do?activeTab=makeComment&keyVal=SXSXWTEXMYY00', 'n_documents': 99, 'case_officer': 'See source', 'comment_date': '2025-09-09', 'agent_address': 'Shahid Ali 215 Bothwell Street Glasgow G2 7EZ', 'date_received': '2025-06-13', 'n_constraints': 26, 'applicant_name': 'See source', 'date_validated': '2025-07-09', 'application_type': 'Matters Specified in Condition', 'n_statutory_days': 61, 'last_advertised_date': '2025-07-18', 'target_decision_date': '2025-09-08'}",100710979-001,,https://www.planit.org.uk/planapplic/Glasgow/25/01338/MSC/,395,Glasgow,2025-09-23T02:44:49.186178,2025-09-23T02:44:49.186178,,,,2025-09-26T08:07:44.429227,,
Ealing/252336OPDCOB,252336OPDCOB,Ealing,"Details of condition 36 (Delivery & Servicing Plan) pursuant to planning permission 20/0122/OUOPDC dated 27/09/2022 for outline planning permission with the details of access, appearance, landscaping, layout and scale reserved for later determination for demolition and redevelopment to comprise a data centre (Use Class B8) of up to 25, 000 sqm gross external, including ancillary offices, internal plant and equipment (including flues), and substation. In addition to the above the Development may also include: car parking; provision of external plant and equipment (including flues) and fuel storage; creation of servicing areas and provision of associated services, including waste, refuse, cycle storage, and lighting; and for the laying out of the buildings; routes and open spaces within the development; and all associated and ancillary works and operations including but not limited to: demolition; earthworks; provision of attenuation infrastructure, engineering operations. Development shall be in accordance with the approved Development Parameters Schedule and Plans (out of borough)",37 - 39 North Acton Road Park Royal NW10 6PF,NW10 6PF,https://pam.ealing.gov.uk/online-applications/applicationDetails.do?keyVal=SXZZOWJM0KK00&activeTab=summary,20/0122/OUOPDC,Small,Permitted,Outline,2025-06-11,2025-07-14,,"{'status': 'No Objection', 'map_url': 'https://pam.ealing.gov.uk/online-applications/applicationDetails.do?activeTab=map&keyVal=SXZZOWJM0KK00', 'decision': 'No Objection', 'docs_url': 'https://pam.ealing.gov.uk/online-applications/applicationDetails.do?activeTab=documents&keyVal=SXZZOWJM0KK00', 'ward_name': 'North Acton', 'decided_by': 'Delegated Decision', 'n_comments': 0, 'source_url': 'https://pam.ealing.gov.uk/online-applications/search.do?action=advanced', 'comment_url': 'https://pam.ealing.gov.uk/online-applications/applicationDetails.do?activeTab=makeComment&keyVal=SXZZOWJM0KK00', 'n_documents': 3, 'case_officer': 'See source', 'date_received': '2025-06-11', 'decision_date': '2025-07-14', 'applicant_name': 'See source', 'date_validated': '2025-06-17', 'application_type': 'OPDC Consultation by Other Boroughs', 'n_statutory_days': 20, 'applicant_address': 'One West Point 7 Portal Way North Acton W3 6RT', 'decision_issued_date': '2025-07-14', 'target_decision_date': '2025-07-07'}",,,https://www.planit.org.uk/planapplic/Ealing/252336OPDCOB/,302,Ealing,2025-07-30T21:53:54.909069,2025-07-30T21:53:54.909069,-0.259756,51.532936,"{'type': 'Point', 'coordinates': [-0.259756, 51.532936]}",2025-08-04T07:58:15.162451,-0.259756,51.532936
Ealing/252233OPDCOB,252233OPDCOB,Ealing,"Details of condition 5 (Noise Modelling) pursuant to planning permission 22/0075/VAROPDC dated 28/09/2022 for application for the variation of conditions 1, 2, 3, 4 and 11 of Reserved Matters Approval 21/0077/REMOPDC for full details of access, layout, scale, appearance and landscaping pursuant to outline planning permission reference 20/0037/FUMOPDC dated 7/9/2020 for a Class B8 Data Centre (data halls, plant rooms, below ground water storage tanks, temporary generators), administration building, sub-station, access, servicing, parking and landscaping. The proposed amendments comprise an increase in lift core heights; changes to plant/transformer gantries; reduction in roof plant screen height; changes to landscaping; changes to internal road layout; and a reduction in the screen height of the temporary generator compound. (Out of borough)",Land At Bashley Road Bashley Road Park Royal NW10 6SN,NW10 6SN,https://pam.ealing.gov.uk/online-applications/applicationDetails.do?keyVal=SXNAQKJM0KW00&activeTab=summary,22/0075/VAROPDC 21/0077/REMOPDC 20/0037/FUMOPDC 7/9/2020,Small,Permitted,Outline,2025-06-10,2025-07-11,,"{'status': 'No Objection', 'map_url': 'https://pam.ealing.gov.uk/online-applications/applicationDetails.do?activeTab=map&keyVal=SXNAQKJM0KW00', 'decision': 'No Objection', 'docs_url': 'https://pam.ealing.gov.uk/online-applications/applicationDetails.do?activeTab=documents&keyVal=SXNAQKJM0KW00', 'ward_name': 'North Acton', 'decided_by': 'Delegated Decision', 'n_comments': 0, 'source_url': 'https://pam.ealing.gov.uk/online-applications/search.do?action=advanced', 'comment_url': 'https://pam.ealing.gov.uk/online-applications/applicationDetails.do?activeTab=makeComment&keyVal=SXNAQKJM0KW00', 'n_documents': 2, 'case_officer': 'See source', 'date_received': '2025-06-10', 'decision_date': '2025-07-11', 'applicant_name': 'See source', 'date_validated': '2025-06-10', 'application_type': 'OPDC Consultation by Other Boroughs', 'n_statutory_days': 20, 'applicant_address': 'One West Point 7 Portal Way North Acton W3 6RT', 'decision_issued_date': '2025-07-11', 'target_decision_date': '2025-06-30'}",,,https://www.planit.org.uk/planapplic/Ealing/252233OPDCOB/,302,Ealing,2025-07-26T03:44:44.050102,2025-07-26T03:44:44.050102,-0.257333,51.528065,"{'type': 'Point', 'coordinates': [-0.257333, 51.528065]}",2025-07-30T07:54:52.3362,-0.257333,51.528065
Ealing/252234OPDCOB,252234OPDCOB,Ealing,"Details of condition 33 (Site Waste Management Plan) pursuant to planning permission 20/0122/OUTOPDC dated 27/09/2022 for outline planning permission with the details of access, appearance, landscaping, layout and scale reserved for later determination for demolition and redevelopment to comprise a data centre (Use Class B8) of up to 25, 000 sqm gross external, including ancillary offices, internal plant and equipment (including flues), and substation. In addition to the above the Development may also include: car parking; provision of external plant and equipment (including flues) and fuel storage; creation of servicing areas and provision of associated services, including waste, refuse, cycle storage, and lighting; and for the laying out of the buildings; routes and open spaces within the development; and all associated and ancillary works and operations including but not limited to: demolition; earthworks; provision of attenuation infrastructure, engineering operations. Development shall be in accordance with the approved Development Parameters Schedule and Plans. (Out of Borough)",37 - 39 North Acton Road Park Royal NW10 6PF,NW10 6PF,https://pam.ealing.gov.uk/online-applications/applicationDetails.do?keyVal=SXNBA2JM0KW00&activeTab=summary,20/0122/OUTOPDC,Small,Permitted,Outline,2025-06-10,2025-07-11,2025-07-02,"{'status': 'Approved', 'map_url': 'https://pam.ealing.gov.uk/online-applications/applicationDetails.do?activeTab=map&keyVal=SXNBA2JM0KW00', 'decision': 'Approved', 'docs_url': 'https://pam.ealing.gov.uk/online-applications/applicationDetails.do?activeTab=documents&keyVal=SXNBA2JM0KW00', 'ward_name': 'North Acton', 'decided_by': 'Delegated Decision', 'n_comments': 0, 'source_url': 'https://pam.ealing.gov.uk/online-applications/search.do?action=advanced', 'comment_url': 'https://pam.ealing.gov.uk/online-applications/applicationDetails.do?activeTab=makeComment&keyVal=SXNBA2JM0KW00', 'n_documents': 2, 'case_officer': 'See source', 'date_received': '2025-06-10', 'decision_date': '2025-07-11', 'applicant_name': 'See source', 'date_validated': '2025-06-10', 'application_type': 'OPDC Consultation by Other Boroughs', 'n_statutory_days': 20, 'applicant_address': 'One West Point 7 Portal Way North Acton W3 6RT', 'decision_issued_date': '2025-07-11', 'target_decision_date': '2025-06-30', 'consultation_end_date': '2025-07-02', 'consultation_start_date': '2025-06-18'}",,,https://www.planit.org.uk/planapplic/Ealing/252234OPDCOB/,302,Ealing,2025-07-26T03:44:44.050074,2025-07-26T03:44:44.050074,-0.259756,51.532936,"{'type': 'Point', 'coordinates': [-0.259756, 51.532936]}",2025-07-30T07:54:52.332416,-0.259756,51.532936
Wycombe/25/06382/MINAMD,25/06382/MINAMD,Wycombe,"Proposed non-material amendment to permission Erection of 4 no. Data centre buildings (sui generis use) together with associated groundworks, plant, electricity sub-station, security fence, gates and piers, landscaping, amendment to existing vehicular access(es), internal roads, service areas and provision of 150 car parking spaces with retention of the existing office building and ""Ballroom"" building fronting Haw Lane for ancillary operational uses and demolition of all other buildings and structures granted under planning ref: 22/06872/VCDN",Former Molins Site Haw Lane Saunderton Buckinghamshire,,https://publicaccess.wycombe.gov.uk/idoxpa-web/applicationDetails.do?keyVal=SXLM0OSCJPJ00&activeTab=summary,22/06872/VCDN,Small,Rejected,Amendment,2025-06-09,2025-07-07,,"{'lat': 51.67991831012572, 'lng': -0.8324807634424206, 'parish': 'Bledlow Cum Saunderton Parish Council', 'status': 'Decided', 'easting': 480819.0, 'map_url': 'https://publicaccess.wycombe.gov.uk/idoxpa-web/applicationDetails.do?activeTab=map&keyVal=SXLM0OSCJPJ00', 'decision': 'Application Refused', 'docs_url': 'https://publicaccess.wycombe.gov.uk/idoxpa-web/applicationDetails.do?activeTab=documents&keyVal=SXLM0OSCJPJ00', 'northing': 198551.0, 'ward_name': 'Ridgeway West', 'agent_name': 'See source', 'decided_by': 'Delegated Decision', 'source_url': 'https://publicaccess.wycombe.gov.uk/idoxpa-web/search.do?action=advanced', 'comment_url': 'https://publicaccess.wycombe.gov.uk/idoxpa-web/applicationDetails.do?activeTab=makeComment&keyVal=SXLM0OSCJPJ00', 'n_documents': 13, 'case_officer': 'See source', 'agent_address': '70 St Mary Axe Montagu Evans London EC3A 8BE United Kingdom', 'date_received': '2025-06-09', 'decision_date': '2025-07-07', 'applicant_name': 'See source', 'date_validated': '2025-06-09', 'application_type': 'Proposed non material amendment', 'n_statutory_days': 28, 'planning_portal_id': 'PP-14034357', 'decision_issued_date': '2025-07-07', 'target_decision_date': '2025-07-07'}",,,https://www.planit.org.uk/planapplic/Wycombe/25/06382/MINAMD/,60,Wycombe,2025-07-23T00:21:22.96991,2025-07-23T00:21:22.96991,-0.832481,51.679918,"{'type': 'Point', 'coordinates': [-0.832481, 51.679918]}",2025-07-25T08:46:24.734116,-0.832481,51.679918
Glasgow/24/01681/NMV01,24/01681/NMV01,Glasgow,"Mixed-use University campus development including: (1) teaching and learning buildings (Class 10) (up to 65,000 sq m); (2) University research buildings (Class 4) (up to 17,000 sq m); (3) commercial research & development/offices (Class 4) (up to 18,000 sq m); (4) retail shops (Class 1) (up to 4,000 sq m); (5) financial, professional and other services (Class 2) (up to 500 sq m; (6) food and drink (Class 3) (up to 2,500 sq m); (7) hotels (Class 7) (up to 12,500 sq m); (8) sports and recreation facilities (Class 11) (up to 500 sq m); (9) day nursery (Class 10) (up to 500 sq m); (10) crche (Class 10) (up to 100 sq m) (11) residential flats (mainstream or student) (sui generis) (up to 14,500.sq m); (12) Data Centre (Class 4) (up to 3,000 sq m); (13) energy centre (sui generis); (14) means of access, servicing and parking arrangements: (15) related infrastructure; (16) related landscaping and (17) related public realm and demolition of existing buildings - approval of matters specified in conditions 2(1-10,12 & 13), 3, 4, 9-15, 22, 27-29, 33, 35-38, 41 & 42 of Planning Permission in Principle 19/00363/PPP, for the erection of a new University building (Class 10), cafe (Class 3), related infrastructure, landscaping and public realm (in so far as these relate to the development of Plot B) - Non Material Variation to planning application 24/01681/MSC.",Site At University Avenue Glasgow,,https://publicaccess.glasgow.gov.uk/online-applications/applicationDetails.do?keyVal=SYEPSHEX1B500&activeTab=summary,"24/01681/MSC 14,500.sq 19/00363/PPP",Small,Permitted,Conditions,2025-06-06,2025-09-15,,"{'parish': 'Hillhead', 'status': 'Decided - Grant', 'map_url': 'https://publicaccess.glasgow.gov.uk/online-applications/applicationDetails.do?activeTab=map&keyVal=SYEPSHEX1B500', 'decision': 'Grant', 'docs_url': 'https://publicaccess.glasgow.gov.uk/online-applications/applicationDetails.do?activeTab=documents&keyVal=SYEPSHEX1B500', 'ward_name': 'Hillhead', 'agent_name': 'See source', 'decided_by': 'Delegated', 'n_comments': 0, 'source_url': 'https://publicaccess.glasgow.gov.uk/online-applications/search.do?action=advanced', 'comment_url': 'https://publicaccess.glasgow.gov.uk/online-applications/applicationDetails.do?activeTab=makeComment&keyVal=SYEPSHEX1B500', 'n_documents': 2, 'case_officer': 'See source', 'agent_address': 'Nikki McAuley 111 McDonald Road Edinburgh EH7 4NW', 'date_received': '2025-06-06', 'n_constraints': 28, 'applicant_name': 'See source', 'date_validated': '2025-06-17', 'application_type': 'Non Material Variation', 'n_statutory_days': 59, 'decision_issued_date': '2025-09-15', 'target_decision_date': '2025-08-15'}",,,https://www.planit.org.uk/planapplic/Glasgow/24/01681/NMV01/,395,Glasgow,2025-09-23T02:44:07.613484,2025-09-23T02:44:07.613484,,,,2025-09-26T08:07:44.307096,,
Edinburgh/25/02924/SCR,25/02924/SCR,Edinburgh,Construction of a Data Centre Campus.,Land 300 Metres North Of 50 Research Avenue North Riccarton Currie,,https://citydev-portal.edinburgh.gov.uk/idoxpa-web/applicationDetails.do?activeTab=summary&keyVal=SXDBH8EW0GY00,,Medium,Permitted,Outline,2025-06-05,2025-07-04,,"{'lat': 55.91649320346845, 'lng': -3.334812668663139, 'parish': 'Currie', 'status': 'Awaiting Assessment', 'easting': 316670.0, 'map_url': 'https://citydev-portal.edinburgh.gov.uk/idoxpa-web/applicationDetails.do?activeTab=map&keyVal=SXDBH8EW0GY00', 'decision': 'EIA Not Required', 'docs_url': 'https://citydev-portal.edinburgh.gov.uk/idoxpa-web/applicationDetails.do?activeTab=documents&keyVal=SXDBH8EW0GY00', 'northing': 670072.0, 'ward_name': 'No Ward Number', 'decided_by': 'Delegated Decision', 'n_comments': 0, 'source_url': 'https://citydev-portal.edinburgh.gov.uk/idoxpa-web/search.do?action=advanced', 'comment_url': 'https://citydev-portal.edinburgh.gov.uk/idoxpa-web/applicationDetails.do?activeTab=makeComment&keyVal=SXDBH8EW0GY00', 'n_documents': 5, 'case_officer': 'See source', 'date_received': '2025-06-05', 'applicant_name': 'See source', 'date_validated': '2025-06-05', 'application_type': 'EIA Screening', 'n_statutory_days': 21, 'applicant_address': 'Ross Sandbach. 3rd Floor 1 Ashley Road Altrincham Cheshire WA14 2DT', 'decision_issued_date': '2025-07-04', 'target_decision_date': '2025-06-26', 'permission_expires_date': '2030-07-04'}",,,https://www.planit.org.uk/planapplic/Edinburgh/25/02924/SCR/,387,Edinburgh,2025-07-10T18:03:21.048818,2025-07-10T18:03:21.048818,-3.334813,55.916493,"{'type': 'Point', 'coordinates': [-3.334813, 55.916493]}",2025-07-11T07:59:16.327215,-3.334813,55.916493
Middlesbrough/25/0319/RCON,25/0319/RCON,Middlesbrough,"Application for the approval of reserved matters (appearance, landscaping, layout, access and scale) following Outline Planning Permission R/2020/0821/ESM in respect of a data centre campus comprising data halls (Use Class B8), office accommodation, substation; battery stores and new access arrangements, car and cycle parking, landscaping, infrastructure and associated works","LAND BOUNDED BY EDGE OF NWL BRAN SANDS TREATMENT PLANT AND FORMER ICI LANDFILL TO SOUTH WEST;, REDCAR BULK TERMINAL TO NORTH WEST LINE OF VEGETATION TOD POINT ROAD",,https://planning.agileapplications.co.uk/middlesbrough/application-details/158502,R/2020/0821/ESM,Small,Permitted,Outline,2025-06-05,2025-07-01,,"{'uprn': 'MAN000000000013397', 'status': 'Decision Issued', 'decision': 'No Objections', 'decided_by': 'Delegated Decision', 'source_url': 'https://planning.agileapplications.co.uk/middlesbrough/search-applications/', 'case_officer': 'See source', 'date_received': '2025-06-05', 'decision_date': '2025-07-01', 'applicant_name': 'See source', 'date_validated': '2025-06-06', 'application_type': 'Redcar and Cleveland Consultation', 'n_statutory_days': 41, 'target_decision_date': '2025-07-17', 'application_expires_date': '2025-06-27'}",,,https://www.planit.org.uk/planapplic/Middlesbrough/25/0319/RCON/,2,Middlesbrough,2025-07-15T02:54:06.160198,2025-07-02T11:48:11.02194,,,,2025-07-15T08:15:25.802512,,
